{
  "schema_version": "ui.scene.v1",
  "scene_id": "act1-kamenitsa-square",
  "title": "Каменица — площадът на занаятчиите",
  "description": "Площадът кипи от подготовка: Стоян ковачът подготвя въжета, жените подреждат сушени билки, а героят усеща тежестта на амулета преди пътя към Мостово.",
  "location": "Каменица, Родопи",
  "area_id": "starting-area",
  "npcs_present": [
    "Стоян ковачът (занаятчия)",
    "Калина билкарката (hook)"
  ],
  "timestamp": "1221-05-12T08:30:00Z"
}
